{
  "run_id": "run-golden-ecom-01",
  "base_url": "http://golden-ecom-01.warm.svc.cluster.local:8080",
  "endpoints": [
    {
      "method": "POST",
      "path": "/orders"
    },
    {
      "method": "GET",
      "path": "/orders/{id}"
    },
    {
      "method": "POST",
      "path": "/orders/{id}/cancel"
    }
  ],
  "source": "openapi"
}
